{"$id":"urn:hivehub:schema:conformance-contract:1","$schema":"https://json-schema.org/draft/2020-12/schema","additionalProperties":false,"properties":{"kind":{"const":"conformance-contract"},"requirements":{"items":{"additionalProperties":false,"properties":{"description":{"type":"string"},"id":{"pattern":"^[a-z0-9][a-z0-9._-]*$","type":"string"}},"required":["id","description"],"type":"object"},"maxItems":256,"type":"array"},"schema_version":{"const":1},"version":{"maxLength":4096,"minLength":1,"type":"string"}},"required":["kind","schema_version","version","requirements"],"title":"conformance-contract","type":"object"}
