{"kind":"conformance-contract","requirements":[{"description":"Joining happens in the person's own Brainstem: its Hive agent join, given exactly the address pin and id = the root pin, copies the shared copy, checks every commit from that root and writes one SSH-signed request file (request: rapp-hive) at requests/<name>/<device>.md. Members admit it by moving it into members/<name>/keys/; new Hives start at 2 approvals.","id":"brainstem-join"},{"description":"python agents/hive_agent.py check <hive-folder> --root <root> passes: every commit after the pinned root has one parent and is signed by a key that its parent lists under members/<name>/keys/, within the rules. Checker: agents/hive_agent.py at kody-w/rapp-model-hive@2bd7c95152ede719b6418b80e2bdc2cd457bf711, SHA-256 e9a2d7243da31fd2388f140bb8138c3d8d2db428ad09075530eb049a0355e8dd.","id":"checker"},{"description":"The Hive follows HIVE-MD.md at kody-w/rapp-model-hive@2bd7c95152ede719b6418b80e2bdc2cd457bf711, SHA-256 f3186e0d88cc36e18582171fff4ed9a68feddc4ae316f66fb8acc2982892fd96: a git repository of markdown files with HIVE.md, members/<name>/keys/<device>.md, requests/, shared/ and former/.","id":"convention"},{"description":"The record's learning bundle carries hive-md/dial-pins.json with exactly address (a credential-free ssh, https or git URL, never a local path), hive (32 lowercase hex), root (the 40-hex first commit) and founder (SHA256:<43 base64>), plus an optional https public_copy; the record's URLs are exactly its URL-valued pins.","id":"dial-pins"},{"description":"Hive Hub only validates the pins and hands them to the person's Brainstem. It never reaches the address, writes into a Hive, runs the Hive agent or its checker, or holds a key, so a private shared copy and a missing one look the same.","id":"hive-hub-inert"},{"description":"The joining Brainstem pins the root commit and the Hive id and shows the founder key fingerprint. The root fixes both; if either differs from its dial pin, the record is wrong and the person stops.","id":"pinned-identity"},{"description":"A named public_copy is a separate reviewed repository with PUBLISHED.md, checked with check-public; it is the Hive's only public face.","id":"public-copy"}],"schema_version":1,"version":"0-experimental"}
